video_url,user_url,username,title,view_num,created_at,shortdesc,collected_at,search_term
/shorts/klZ6YNObQ5w,/@DryBarComedy,Dry Bar Comedy,The only minority group you can join at any time 😂 | Josh Blue Stand-Up Comedy,23M,4 months,Comedian Josh Blue jokes about being a part of the disabled community. Watch hundreds of Dry Bar Comedy specials on the ...,2026-01-22 06:02:20.236358,disabled community
/shorts/gedXelq0jWU,/@SquirmyandGrubs,Squirmy and Grubs,Some children are disabled but not all disabled people are children,825K,3 years,shorts #squirmyandgrubs #children.,2026-01-22 06:02:20.239159,disabled community
/watch?v=m_AyaVYa3aI&pp=ygUSZGlzYWJsZWQgY29tbXVuaXR50gcJCYcKAYcqIYzv,/@DryBarComedy,Dry Bar Comedy,Anyone Can Join the Disabled Community at Any Time | Josh Blue Stand-Up Comedy,118K,3 months,"Comedian Josh Blue jokes about his disability, kids, and more! Check out Josh's 2 full specials here!",2026-01-22 06:02:20.240425,disabled community
/watch?v=5dKqpqdZuCs&pp=ygUSZGlzYWJsZWQgY29tbXVuaXR50gcJCYcKAYcqIYzv,/@epochstories,EPOCH,Living with disability | PEOPLE,109K,6 years,Jordan was born with Spina Bifida and Hydrocephalus. This documentary focuses on Jordan's story and the challenges of living ...,2026-01-22 06:02:20.243148,disabled community
/watch?v=xFnC7YULtn8&pp=ygUSZGlzYWJsZWQgY29tbXVuaXR5,/@NJSpotlightNews,NJ Spotlight News,Transitioning Developmentally Disabled to Community Living,104K,10 years,"DInstead of living in an institution, some developmentally disabled patients have been transitioning to group homes. Rutgers has ...",2026-01-22 06:02:20.244725,disabled community
/shorts/_3fjqnl9WwU,/@ChronicallyJenni,Chronically Jenni,7 Everyday Hacks You Wouldn’t Have Without Disabled People! #DisabilityAwareness,3.8M,6 months,7 Everyday Hacks You Wouldn't Have Without Disabled People! You know the little ramp at the end of a pavement? That's called ...,2026-01-22 06:02:20.246050,disabled community
/watch?v=kaVkKQTTei8&pp=ygUSZGlzYWJsZWQgY29tbXVuaXR5,/@jubilee,Jubilee,Do All Disabled People Think The Same? | Spectrum,3M,6 years,Follow us on INSTAGRAM: https://www.instagram.com/jubileemedia/ Erin: https://www.instagram.com/erin_laulau/ Jason: ...,2026-01-22 06:02:20.247808,disabled community
/watch?v=_b7k6pEnyQ4&pp=ygUSZGlzYWJsZWQgY29tbXVuaXR5,/@BuzzFeedVideo,BuzzFeedVideo,Things People With Disabilities Wish You Knew,1M,7 years,Special Thanks: Pamela Rae Schuller @PamelaComedy Eman Rimawi @Eman_Rimawi Credits: ...,2026-01-22 06:02:20.249741,disabled community
/watch?v=JTVwTuuqVkQ&pp=ygUSZGlzYWJsZWQgY29tbXVuaXR5,/@pbsorigins,PBS Origins ,Do Disabled People Really Have The Same Rights?,100K,1 year,"In 1999, two brave women with disabilities took on the state of Georgia. What happened next was a groundbreaking Supreme ...",2026-01-22 06:02:20.251072,disabled community
/watch?v=mt-4RTXpte0&pp=ygUSZGlzYWJsZWQgY29tbXVuaXR50gcJCYcKAYcqIYzv,/@nowthis,NowThis,How Nick Linnehan Creates Visibility for Talent in the Disabled Community | SEEN | NowThis,915,6 years,We're trapped in this box called 'identity.'' — This man founded an inclusive theater group to highlight talent and create ...,2026-01-22 06:02:20.252918,disabled community
/watch?v=U-54-kWJd4E&pp=ygUSZGlzYWJsZWQgY29tbXVuaXR5,/@cbsphilly,CBS Philadelphia,Nonprofit Baker Industries is providing opportunities for disabled community and more,281,2 months,"This week's Spreading the Love is dedicated to National Disability Awareness Month, where reporter Wakisha Bailey shines a ...",2026-01-22 06:02:20.254225,disabled community
/shorts/FHuzT6IgHks,/@coleandcharisma,Roll with Cole & Charisma,Our Husbands Are Disabled,79M,2 years,Loved doing this trend with our friends @SquirmyandGrubs.,2026-01-22 06:02:20.255788,disabled community
/watch?v=E6ZMxujrAJk&pp=ygUSZGlzYWJsZWQgY29tbXVuaXR5,/@ColoradoSpringsGazettenews,Gazette Visuals,Breaking Down Barriers for the disabled community,24,10 years,"The Gazette's Eric Singer and Stephen Hobbs take an indepth look at what the disabled community tells them is a legal loophole, ...",2026-01-22 06:02:20.258354,disabled community
/watch?v=Z3faUGgMsNI&pp=ygUSZGlzYWJsZWQgY29tbXVuaXR50gcJCYcKAYcqIYzv,/@AustralianGreens,Australian Greens,We need to talk about disability,96K,7 years,"We need to remove the barriers that stop disabled people from participating in society fully, on an equal basis with everyone else.",2026-01-22 06:02:20.259682,disabled community
/shorts/e89kIM6hkyM,/@InfiniteVoicesCarryOn,Infinite Voices Carry On,Can Local Restaurants Help Our Disabled Community?,1.1K,6 months,Infinite Voices Carry On is seeking support for a charity food delivery drive to provide fresh meals to the disabled and elderly ...,2026-01-22 06:02:20.261028,disabled community
/watch?v=8eIKYKWU-VE&pp=ygUSZGlzYWJsZWQgY29tbXVuaXR5,/@Channel4News,Channel 4 News,A right to love for the disabled community?,35K,8 years,For many years we've been exposing the uphill battle faced by many people in the deaf and disabled community to secure basic ...,2026-01-22 06:02:20.262293,disabled community
/shorts/K55b_EH7rOU,/@TonyJacobsenUNBREAKABLE,Tony Jacobsen #UNBREAKABLE,A one-of-a-kind event for the disabled community!,224,2 years,"Join us for this one-of-a-kind event for the disability community! ""Power In Disability: Encouragement Through Confidence, Health, ...",2026-01-22 06:02:20.263640,disabled community
/shorts/4omY_6zD4fo,/@SquirmyandGrubs,Squirmy and Grubs,Representation Matters,17M,1 year,Disability representation in Halloween decor is so important! Our latest vlog: https://youtu.be/JPSRDskYW1s.,2026-01-22 06:02:27.777777,disabled community
/shorts/pfS_LGp6oAc,/@ChronicallyJenni,Chronically Jenni,Invisible Disabilities Week 2023,49K,2 years,... or putting on make up can be extremely exhausting for disabled people & often leave us feeling much worse than we did before.,2026-01-22 06:02:27.778966,disabled community
/shorts/ItpfEkVjaus,/@SarahToddHammer,Sarah Todd Hammer,Stop telling disabled people to do things differently #Disability #Disabled #Ableism,8.6K,9 hours,"Get 10% off hands-free Kizik shoes: https://get.aspr.app/SH15St Get 15% off accessible flosser, Flaus: ...",2026-01-22 06:02:27.780111,disabled community
/shorts/cNKvpBPUhOA,/@Vogue,Vogue,What The Disabled Community Has Taught Selma Blair,94K,2 years,"Selma Blair owes it all to the disabled community around her. Footage of Selma Blair, a white female with short bleach blonde hair ...",2026-01-22 06:02:27.782603,disabled community
/watch?v=mG4KL9KXRgI&pp=ygUSZGlzYWJsZWQgY29tbXVuaXR50gcJCYcKAYcqIYzv,/@cgtnamerica,CGTN America,Tech for disabled community benefits everyone,127,9 days,Ariel Simms is CEO and President of Disability Belongs.The nonprofit works to create systemic change in how society views and ...,2026-01-22 06:02:27.783939,disabled community
/watch?v=Po5t4fmKpZM&pp=ygUSZGlzYWJsZWQgY29tbXVuaXR5,/@ActivistVictor,VictorTheMisanthrope,I am done with the disabled community as a whole,381,3 years,"After the latest in a neverending string of frustrating, hurtful, rude, callous interactions with some facet of the disabled community, ...",2026-01-22 06:02:27.785636,disabled community
/shorts/XAGrI_5UIs4,/@60MinutesAU,60 Minutes Australia,Donald Trump's shocking comments about people with disabilities | 60 Minutes Australia,154K,1 year,Donald Trump's nephew has accused the former president of making heartless comments about people with disabilites - including ...,2026-01-22 06:02:27.787117,disabled community
/shorts/hqSNA4lmSvs,/@CatarinaRivera,BlindishLatina,To My Disabled Community,134,10 months,"To My Disabled Community: WHAT YOU CAN DO As a light-skinned Latiné person, I have privilege and I recognize that. Not all ...",2026-01-22 06:02:27.788387,disabled community
/shorts/IT4ZiZnX2kc,/@brianswift2654,BREAKING BARRIERS PODCAST powered by S.O.A.R,Adventure for Disabled: Fulfilling Lives & Building Community #shorts,248,3 months,"This 501(c)(3) provides adventures for disabled people, opportunities often not available. There are 61 million disabled people in ...",2026-01-22 06:02:27.791719,disabled community
/shorts/naRgyzGIdQw,/@brianswift2654,BREAKING BARRIERS PODCAST powered by S.O.A.R,Why the Disabled Community Lacks the Support It Needs #shorts,532,4 months,"Discover why the disabled community struggles to gain support compared to other groups. Without strong advocacy, survival ...",2026-01-22 06:02:27.792938,disabled community
/watch?v=vva7P3W9c_A&pp=ygUSZGlzYWJsZWQgY29tbXVuaXR50gcJCYcKAYcqIYzv,/@WSAV3,WSAV3,LIFE Inc. helps disabled community fare pandemic,13,5 years,LIFE INC.,2026-01-22 06:02:27.796505,disabled community
/watch?v=vyz0hOxg4A0&pp=ygUSZGlzYWJsZWQgY29tbXVuaXR5,/@WSFLCommercial,WSFL,Ann Stork Center: Supporting South Florida's Developmentally Disabled Community,20,1 year,Ann Stork Center: Supporting South Florida's Developmentally Disabled Community.,2026-01-22 06:02:27.800994,disabled community
/shorts/c9Svu6zs3kw,/@nothingventuredpodcast,Nothing Ventured,Martyn Sibley: The Power of Language in Empowering the Disabled Community,69,2 years,"Language is a crucial aspect of disability empowerment and inclusion, as discussed in the podcast. The social model and the ...",2026-01-22 06:02:27.802653,disabled community
/shorts/TiO4omwEIlQ,/channel/UCLvAmmzhy_4kl2oMje9Rk5w,Zara Beth,The disabled community saved me!!! 💛🌈🫶🏻 #disability #autismdiagnosis #neurodivergent,38K,9 months,The disabled community saved me I grew up as an undiagnosed autistic person and then developed chronic illnesses as a ...,2026-01-22 06:02:27.808719,disabled community
/watch?v=lt6KA4yfYB8&pp=ygUSZGlzYWJsZWQgY29tbXVuaXR5,/@newsonkfdm,KFDM YouTube,DuGood By Giving: Arc of Greater Beaumont supports disabled community,76,3 months,"The Arc of Greater Beaumont, a nonprofit organization in Jefferson County, is dedicated to supporting adults and children with ...",2026-01-22 06:02:27.809805,disabled community
/watch?v=MFTwXiExae0&pp=ygUSZGlzYWJsZWQgY29tbXVuaXR5,/@PBSNewsHour,PBS NewsHour,New book ‘Unfit Parent’ provides parenting lessons from the disabled community | ASL interpretation,1.7K,8 months,"Last year, the surgeon general warned that parents in the United States are overwhelmed and burnt out. One group of parents is ...",2026-01-22 06:02:27.811741,disabled community
/watch?v=mt-4RTXpte0&pp=ygUSZGlzYWJsZWQgY29tbXVuaXR5,/@nowthis,NowThis,How Nick Linnehan Creates Visibility for Talent in the Disabled Community | SEEN | NowThis,915,6 years,We're trapped in this box called 'identity.'' — This man founded an inclusive theater group to highlight talent and create ...,2026-01-22 06:02:36.256829,disabled community
/watch?v=kWouwzIHnxw&pp=ygUSZGlzYWJsZWQgY29tbXVuaXR5,/@marylandersonline,Marylanders Online,Accessibility for the Intellectually Disabled Community,56,1 year,Gain a deeper understanding of accessible and assistive technology that can support individuals with intellectual disabilities and ...,2026-01-22 06:02:36.259849,disabled community
/watch?v=7lhKF33pshY&pp=ygUSZGlzYWJsZWQgY29tbXVuaXR5,/@officialwestchestergovvide4703,Official Westchester Gov Videos,The Census and our Disabled Community,238,5 years,"This third PSA features Janet Lokay, Assistant to the County Executive. As an advocate for people with disabilities, Lokay stressed ...",2026-01-22 06:02:36.262141,disabled community
/watch?v=UEW6TOef9mE&pp=ygUSZGlzYWJsZWQgY29tbXVuaXR5,/@cbcbarbados246,Caribbean Broadcasting Corporation,Plans to serve the disabled community forging ahead,713,3 years,Government's plans to better serve the disabled community continue to forge ahead. Anmarie Bailey has the details. Subscribe to ...,2026-01-22 06:02:36.263238,disabled community
/watch?v=nNy-eq7S-Fo&pp=ygUSZGlzYWJsZWQgY29tbXVuaXR50gcJCYcKAYcqIYzv,/@ABC10,ABC10,How disabled community could face hurdles ahead of vaccination,232,4 years,People with disabilities and their family members share in the excitement and fears of eligibility opening March 15. Subscribe at: ...,2026-01-22 06:02:36.269135,disabled community
/watch?v=A0-vxzxExLU&pp=ygUSZGlzYWJsZWQgY29tbXVuaXR5,/@everyonecanuk,Everyone Can,How our gaming sessions help the disabled community!,141,5 years,Find out from parents what they think of our gaming sessions and how it is helping their children.,2026-01-22 06:02:36.271190,disabled community
/shorts/CrKaAEsdb4M,/@LifetotheMaxPodcast,Life to the Max Podcast,Disabled Community Strength: A Unified Voice #shorts,266,4 months,"Together, we're stronger Keeping the disabled community connected means more support, more voices, and more change.",2026-01-22 06:02:36.272749,disabled community
/watch?v=v5MCjuYoPsM&pp=ygUSZGlzYWJsZWQgY29tbXVuaXR5,/@janete_weinstein,Janete Weinstein ,Plane Pull to support the local disabled community | California,10,3 years,Can you imagine pulling a 100 thousand pound airplane? That is what happened right here in our backyard. The airport teamed ...,2026-01-22 06:02:36.275956,disabled community
/watch?v=PX9reO3QnUA&pp=ygUSZGlzYWJsZWQgY29tbXVuaXR5,/@CNN,CNN,Trump mocks reporter with disability,9.9M,10 years,"Donald Trump is under fire again, this time for mocking a New York Times reporter that suffers from a chronic condition.",2026-01-22 06:02:36.277061,disabled community
/watch?v=qH_ysGAaNUI&pp=ygUSZGlzYWJsZWQgY29tbXVuaXR5,/@KHONNewsHawaii,KHON2 News,Cracked sidewalks create obstacles for Molokai's disabled community,86,12 years,A video that reveals the disrepair of sidewalks and walkways on Molokai has grabbed the attention of island residents and ...,2026-01-22 06:02:36.278177,disabled community
/watch?v=H2zJiMPGZAs&pp=ygUSZGlzYWJsZWQgY29tbXVuaXR5,/@11Alive,11Alive,Advocates for disabled community push to get vaccine sooner,181,4 years,The families and advocates for people with developmental disabilities is pushing to get them vaccines sooner.,2026-01-22 06:02:36.280444,disabled community
/watch?v=HnYpfrTI0FQ&pp=ygUSZGlzYWJsZWQgY29tbXVuaXR5,/@DavacrestHUB,Davacrest HUB,Let's uplift the Disabled community together!,393,9 months,Davacrest Hub was born out of a mother's passion and resilience in raising her son who is living with Cerebral Palsy. Her journey ...,2026-01-22 06:02:36.283671,disabled community
/watch?v=zE7Iej1q_R8&pp=ygUSZGlzYWJsZWQgY29tbXVuaXR5,/@bigcountryhomepage7078,BigCountryHomepage,Housing Authority to create affordable housing for disabled community,47,7 years,Housing Authority to create affordable housing for disabled community.,2026-01-22 06:02:36.284876,disabled community
/watch?v=cSWw05o9oE4&pp=ygUSZGlzYWJsZWQgY29tbXVuaXR5,/@nationalhousingresourcecen3953,National Housing Resource Center,The Disabled Community  How We Can Serve Them Better,141,4 years,So this is our mission statement we partner with people with disabilities their families and their allies to create and sustain ...,2026-01-22 06:02:44.949341,disabled community
/watch?v=lJpsdEL197Y&pp=ygUSZGlzYWJsZWQgY29tbXVuaXR5,/@PIX11News,PIX11 News,Daniel`s Music hopes to build bridge between disabled community and non-disabled,108,6 years,"Daniel`s Music, a non-profit that provides free music programs for people with disabilities, has now started a ""Baby and Me"" class.",2026-01-22 06:02:44.953829,disabled community
/watch?v=F9_7Dl7-Azg&pp=ygUSZGlzYWJsZWQgY29tbXVuaXR5,/@680news,680 NEWS,"Disabled community feels overlooked during pandemic, say advocates",57,5 years,Disability advocates say many in the community are feeling overlooked by the government during the coronavirus pandemic.,2026-01-22 06:02:44.957584,disabled community
/watch?v=5Io5NAt9Ndc&pp=ygUSZGlzYWJsZWQgY29tbXVuaXR5,/@bigcountryhomepage7078,BigCountryHomepage,Housing Authority to create affordable housing for disabled community,460,7 years,Housing Authority to create affordable housing for disabled community.,2026-01-22 06:02:44.962043,disabled community
/watch?v=hZccQWpIMQE&pp=ygUSZGlzYWJsZWQgY29tbXVuaXR5,/@awenetwork8282,AWE Network,"Including the Disabled Community in Resilience, Response and Recovery",5,3 months,Join the AWE Network with Renee Santos to hear more about ways to rethink inclusion in emergencies and learn how we can ...,2026-01-22 06:02:44.963184,disabled community
/watch?v=EB7VFC3yapg&pp=ygUSZGlzYWJsZWQgY29tbXVuaXR5,/@nowthisimpact,NowThis Impact,Ola Ojewumi on the Racial Divide in the Disabled Community,10K,3 years,'One of the biggest divides in the disabled community is race' — Activist Ola Ojewumi says it's time for the white disability ...,2026-01-22 06:02:44.965488,disabled community
/watch?v=OwbUExB6OJU&pp=ygUSZGlzYWJsZWQgY29tbXVuaXR5,/@KingCountyTV,KingCountyTV,The Disabled Community's History of Advocacy,102,1 year,The King County Archives uncovers advocacy and partnerships dating back to the 1940's. A new state grant and a digital scanner ...,2026-01-22 06:02:44.969147,disabled community
/watch?v=E_AwucJhrq4&pp=ygUSZGlzYWJsZWQgY29tbXVuaXR5,/@cbssacramento,CBS News Sacramento,"Sidewalk showdown underway between disabled community and city, county over homeless camps",1.9K,2 years,Sacramento's disabled community is suing the city and county to clear the sidewalks of encampments they say violate the ...,2026-01-22 06:02:44.970390,disabled community
/watch?v=h06ZAASzuQg&pp=ygUSZGlzYWJsZWQgY29tbXVuaXR5,/@CBSNews,CBS News,Members of disabled community struggle to get COVID shots as eligibility expands,12K,4 years,"Now that the coronavirus vaccine is available to all adult Americans, the Biden administration is working to make sure that ...",2026-01-22 06:02:44.975675,disabled community
/watch?v=qTvRSQ5p6xQ&pp=ygUSZGlzYWJsZWQgY29tbXVuaXR5,/@thefamilycafe17,The Family Cafe,Disaster Recovery Support for the Disabled Community,28,6 months,"This My Needs Network initiative is a collaborative effort that integrates AI technology, community-based participatory research ...",2026-01-22 06:02:44.977957,disabled community
/shorts/iPVBM5vgMgg,/@palmermediapods,Palmer Media,AI's Transformative Power for the Disabled Community | Dr. Amy Lomellini on Trending in Ed,62,10 months,Dr. Amy Lomellini is the Director of Accessibility for Anthology. Here she highlights how AI can really be a game changer for the ...,2026-01-22 06:02:44.979106,disabled community
/watch?v=QqRIr009zCQ&pp=ygUSZGlzYWJsZWQgY29tbXVuaXR5,/@Wate6News,WATE 6 On Your Side,Emory Valley Center continues to serve disabled community in Anderson County,45,7 months,The Emory Valley Center is a grassroots organization in the heart of Oak Ridge that serves thousands of people in their ...,2026-01-22 06:02:44.980319,disabled community
/watch?v=RbNFb2fkgcU&pp=ygUSZGlzYWJsZWQgY29tbXVuaXR50gcJCYcKAYcqIYzv,/@GlendaleArizona,Glendale Arizona,Glendale's Empowerment Expo unites the disabled community with service providers.,118,9 years,"Showcasing the ability, mobility, and adaptability for special needs in the work place, the City of Glendale holds the Empowerment ...",2026-01-22 06:02:44.981390,disabled community
/watch?v=stm4uAf-obg&pp=ygUSZGlzYWJsZWQgY29tbXVuaXR5,/@KHONNewsHawaii,KHON2 News,State helps disabled community affected by pandemic,161,4 years,State helps disabled community affected by pandemic.,2026-01-22 06:02:44.983103,disabled community
/watch?v=ywsKyFMuklM&pp=ygUSZGlzYWJsZWQgY29tbXVuaXR5,/@IcsnyOrgHealth,Independence Care System (ICS),Daniel Tratt and ICS's incredible support to the disabled community,55,7 years,"THUMBS UP if you liked this video, please SHARE IT! Daniel Tratt is former president and current board member of the New York ...",2026-01-22 06:02:44.984137,disabled community
/watch?v=ZSU5khOBwqg&pp=ygUSZGlzYWJsZWQgY29tbXVuaXR5,/@cbcbarbados246,Caribbean Broadcasting Corporation,Call for inclusion of disabled community,659,3 years,"Barbadians can and should do more to support the disabled community. This from Director of the National Disabilities Unit, John ...",2026-01-22 06:02:44.985199,disabled community
/watch?v=BpRTn7c5yc8&pp=ygUSZGlzYWJsZWQgY29tbXVuaXR5,/@WTHR13News,WTHR,Advocates urge disabled community to vote,132,1 year,The Caravan for Disability and Justice 2024 visited Wednesday.,2026-01-22 06:02:44.988184,disabled community
